{
  "$schema": "cooparticlesapi:coofx/schema/v1",
  "schemaVersion": 1,
  "coordinateSystem": "coofx_rh_y_up_z_south",
  "assetSeed": "0123456789abcdef",
  "model": "cooparticlesapi:coofx/models/examples/rigid_burst.gltf",
  "scene": 0,
  "clips": [
    {
      "id": "spin",
      "animation": "Spin",
      "loopMode": "LOOP"
    }
  ],
  "materials": [
    {
      "id": "default",
      "gltfMaterial": "RigidBurstMaterial",
      "baseColorTexture": "cooparticlesapi:textures/coofx/rigid_burst.png",
      "alphaMode": "MASK",
      "doubleSided": false,
      "alphaCutoff": 0.5
    }
  ],
  "emitters": [
    {
      "id": "rigid_burst",
      "mesh": "RigidBurstMesh",
      "node": "RigidBurstNode",
      "count": 16,
      "delayTicks": 0,
      "lifetimeTicks": 40,
      "velocity": {
        "min": [-0.05, 0.1, -0.05],
        "max": [0.05, 0.2, 0.05]
      },
      "rotationRadians": {
        "min": [0.0, 0.0, 0.0],
        "max": [0.0, 6.283185307179586, 0.0]
      },
      "scale": {
        "min": [0.8, 0.8, 0.8],
        "max": [1.2, 1.2, 1.2]
      }
    }
  ],
  "requiredExtensions": [],
  "extensions": {
    "cooparticlesapi:blender_export": {
      "sourceCoordinateSystem": "blender_rh_z_up_minus_y_forward",
      "targetCoordinateSystem": "coofx_rh_y_up_z_south",
      "vectorMapping": ["x", "z", "-y"],
      "unitScale": 1.0,
      "handednessChanged": false,
      "windingChanged": false,
      "conversionOwner": "blender_official_gltf_exporter"
    }
  }
}
