{"$schema":"cooparticlesapi:coofx/schema/v1","schemaVersion":1,"coordinateSystem":"coofx_rh_y_up_z_south","assetSeed":"0123456789abcdef","model":"cooparticlesapi:coofx/models/camera-control.gltf","scene":0,"clips":[{"id":"camera_track","animation":"CameraTrack","loopMode":"ONCE"}],"emitters":[],"requiredExtensions":[],"extensions":{}}